{
  "schema_version": "pr-hard-qualification-v0.4",
  "task_id": "pr-hard:apache-tvm-20107",
  "qualified_at": "2026-08-26",
  "automated_status": "passed",
  "human_review": {
    "status": "complete_pass",
    "counts_as_completed_human_review": true,
    "annotation_file": "manifests/annotations/pr_hard_v0.4/apache_tvm_20107/annotator_a.json",
    "annotator_id": "annotator_a",
    "parallelizability_label": "partially_parallelizable",
    "reviewed_at": "2026-08-29"
  },
  "provenance": {
    "base_sha": "0468e13a1450a4429758003612aa2b3d080c1f13",
    "gold_sha": "bb9bc20a8294fb19a2a40f029fe57baa546a8206",
    "gold_first_parent_is_base": true,
    "production_diff": {
      "files": 22,
      "additions": 430,
      "deletions": 61,
      "matches_editable_paths": true
    }
  },
  "source_integrity": {
    "public_overlays": [
      {
        "path": "data/overlays/pr_hard/apache_tvm_20107/0001-public-regression-tests.patch",
        "sha256": "2bf2a42a33f4d71da3eab1b6508c14a1e0185aace965ecc74235db3391ee1684"
      }
    ],
    "test_only": true,
    "apply_cleanly_in_order": true,
    "model_visible_git_history": false,
    "model_visible_gold_patch": false,
    "model_trajectory_used_for_construction": false
  },
  "environment": {
    "registry": "configs/environments/pr_hard_tvm.v0.4.json",
    "profile": "tvm-cpu-llvm-source-build",
    "conda_lock_sha256": "1c44901e30620de95c78a35e6d72230868ffdbcf206bda6143706e1ba0e83618",
    "requirements_lock_sha256": "b2279a1089af16e16e267f554e009617883c995ce891ffdf69dc73f5060d1fb0",
    "recursive_submodule_manifest_sha256": "b99a4ed564aecb0175670f1407a39e8e778f0ceef18f5cd2000ec631a4331b95",
    "tvm_ffi_sha": "12dbf053b3d9ba4ebd9da3123b1aeca79cf74229",
    "configure": [
      "cmake",
      "-S",
      ".",
      "-B",
      "build",
      "-G",
      "Ninja",
      "-DCMAKE_BUILD_TYPE=RelWithDebInfo",
      "-DUSE_LLVM=llvm-config",
      "-DUSE_CUDA=OFF",
      "-DUSE_GTEST=OFF"
    ],
    "cold_build_elapsed_seconds": 530,
    "cold_build_timing_method": "filesystem_birthtime_delta_from_CMakeCache_to_libtvm_compiler",
    "gpu_execution_required": false
  },
  "evaluator_runs": [
    {
      "stage": "base_focused",
      "expected": "red",
      "exit_code": 1,
      "collected": 3,
      "duration_seconds": 0.58,
      "outcomes": {"passed": 0, "failed": 3},
      "notes": "The generic document printer and both dialect round trips fail for missing function type-parameter support."
    },
    {
      "stage": "gold_focused",
      "expected": "green",
      "exit_code": 0,
      "collected": 3,
      "duration_seconds": 0.32,
      "outcomes": {"passed": 3}
    },
    {
      "stage": "gold_role_local",
      "expected": "green",
      "exit_code": 0,
      "collected": 3,
      "duration_seconds": 0.32,
      "outcomes": {"passed": 3},
      "notes": "One exact selector for the shared core and one for each independent dialect consumer passed."
    },
    {
      "stage": "gold_regression",
      "expected": "green",
      "exit_code": 0,
      "collected": 503,
      "duration_seconds": 10.36,
      "outcomes": {"passed": 501, "xfailed": 2},
      "notes": "The complete selected generic Script, Relax, and TIRx parser/printer suites passed; two pre-existing expected failures remained xfailed."
    }
  ],
  "role_local_observability": [
    {
      "subproblem_id": "shared_script_signature_core",
      "base_status": "base_red",
      "selectors": [
        "tests/python/tvmscript/test_tvmscript_printer_python_doc_printer.py::test_print_function_doc_with_type_params"
      ]
    },
    {
      "subproblem_id": "relax_dependent_signature",
      "base_status": "base_red",
      "selectors": [
        "tests/python/relax/test_tvmscript_type_vars.py::test_type_vars_roundtrip"
      ]
    },
    {
      "subproblem_id": "tirx_dependent_signature",
      "base_status": "base_red",
      "selectors": [
        "tests/python/tirx/test_tvmscript_type_vars.py::test_type_vars_roundtrip"
      ]
    }
  ],
  "dependency_checkers": [
    {
      "dependency_id": "shared-core-to-relax-signature",
      "upstream": "passed",
      "downstream": "passed",
      "integrated": "passed",
      "finding": "Shared-core-only passes 1/3 focused selectors; adding Relax passes exactly the core and Relax selectors while TIRx remains red."
    },
    {
      "dependency_id": "shared-core-to-tirx-signature",
      "upstream": "passed",
      "downstream": "passed",
      "integrated": "passed",
      "finding": "Shared-core-only passes 1/3 focused selectors; adding TIRx passes exactly the core and TIRx selectors while Relax remains red."
    }
  ],
  "runtime_package_validation": {
    "validated_at": "2026-08-26",
    "seed_commit": "1b8988ee90c2781e262c7f2bc742e6974c5c6554",
    "seed_commit_count": 1,
    "seed_has_remotes": false,
    "task_local_ffi_version": "0.1.dev1+g12dbf053b",
    "task_local_ffi_editable": false,
    "base_focused": {"passed": 0, "failed": 3},
    "gold_regression": {"passed": 501, "skipped": 0}
  },
  "remaining_gates": []
}
